s,kudos,title,summary,datePublished,words,rating,romanticCategory,publicationStatus,keyword,relationship,polyship_human_flag,member,members_found,combined_text,ner_persons,title_masked,summary_masked,combined_text_masked,modela_text_raw,modelb_text_masked,summary_masked_length,title_masked_length,combined_text_masked_length
https://golemlab.eu/graph/12763404,37,Dr. Kim Seok-Jin,"Today was the absolute worst day of your life- being late for school, forgetting about a hundred point test, and a sprained ankle as the cherry on top. However, this changes when you meet possibly the most handsome person ever.",2017-11-19,1906,General Audiences,F/M,Completed,Alternate Universe - Jjeoreo | Dope | Doctor Jin | Fluff and Humor | I Don't Even Know | No Smut | not exactly,Kim Seokjin | Jin/Reader,False,seokjin,{'seokjin'},"Title: Dr. Kim Seok-Jin [SEP] Summary: Today was the absolute worst day of your life- being late for school, forgetting about a hundred point test, and a sprained ankle as the cherry on top. However, this changes when you meet possibly the most handsome person ever.",{'Kim Seok-Jin'},dr. [MEMBER],"today was the absolute worst day of your life- being late for school, forgetting about a hundred point test, and a sprained ankle as the cherry on top. however, this changes when you meet possibly the most handsome person ever.","Title: dr. [MEMBER] [SEP] Summary: today was the absolute worst day of your life- being late for school, forgetting about a hundred point test, and a sprained ankle as the cherry on top. however, this changes when you meet possibly the most handsome person ever.","Dr. Kim Seok-Jin Today was the absolute worst day of your life- being late for school, forgetting about a hundred point test, and a sprained ankle as the cherry on top. However, this changes when you meet possibly the most handsome person ever.","dr. [MEMBER] today was the absolute worst day of your life- being late for school, forgetting about a hundred point test, and a sprained ankle as the cherry on top. however, this changes when you meet possibly the most handsome person ever.",40,2,45
https://golemlab.eu/graph/15434778,37,Shy Guy,"❝ Seokjin really didn’t care if playing Mario Games decreased his attractiveness from the point of view of some girls. He loved Mario. Plus, he was worldwide handsome. If anything, playing Mario only added to his handsomeness, he thought. ❞",2018-07-26,2122,General Audiences,F/M,Completed,Airport Fluff | Fluff | Idol Kim Seokjin | Jin | Inspired by BTS Festa | literally just fluff,Kim Seokjin | Jin/Reader Series: oneshots [1],False,seokjin,{'seokjin'},"Title: Shy Guy [SEP] Summary: ❝ Seokjin really didn’t care if playing Mario Games decreased his attractiveness from the point of view of some girls. He loved Mario. Plus, he was worldwide handsome. If anything, playing Mario only added to his handsomeness, he thought. ❞","{'Mario Games', 'Mario'}",shy guy,"❝ [MEMBER] really didn’t care if playing mario games decreased his attractiveness from the point of view of some girls. he loved mario. plus, he was [MEMBER]. if anything, playing mario only added to his handsomeness, he thought. ❞","Title: shy guy [SEP] Summary: ❝ [MEMBER] really didn’t care if playing mario games decreased his attractiveness from the point of view of some girls. he loved mario. plus, he was [MEMBER]. if anything, playing mario only added to his handsomeness, he thought. ❞","Shy Guy ❝ Seokjin really didn’t care if playing Mario Games decreased his attractiveness from the point of view of some girls. He loved Mario. Plus, he was worldwide handsome. If anything, playing Mario only added to his handsomeness, he thought. ❞","shy guy ❝ [MEMBER] really didn’t care if playing mario games decreased his attractiveness from the point of view of some girls. he loved mario. plus, he was [MEMBER]. if anything, playing mario only added to his handsomeness, he thought. ❞",38,2,43
https://golemlab.eu/graph/14158575,37,Car wash,"What better way to spend your only time off, if not doing absolutely nothing? Y/N goes to prove her boyfriend wrong by washing her car, which can be fun and productive as much as cooking. Will Jin ever see it as fun?",2018-03-31,4135,General Audiences,F/M,Completed,Cheesy | Domestic Fluff | Established Relationship | Fluff | Love | Making Out | Romance,Kim Seokjin | Jin/Reader,False,seokjin,{'seokjin'},"Title: Car wash [SEP] Summary: What better way to spend your only time off, if not doing absolutely nothing? Y/N goes to prove her boyfriend wrong by washing her car, which can be fun and productive as much as cooking. Will Jin ever see it as fun?",{'Will Jin'},car wash,"what better way to spend your only time off, if not doing absolutely nothing? You goes to prove her boyfriend wrong by washing her car, which can be fun and productive as much as cooking. will [MEMBER] ever see it as fun?","Title: car wash [SEP] Summary: what better way to spend your only time off, if not doing absolutely nothing? You goes to prove her boyfriend wrong by washing her car, which can be fun and productive as much as cooking. will [MEMBER] ever see it as fun?","Car wash What better way to spend your only time off, if not doing absolutely nothing? Y/N goes to prove her boyfriend wrong by washing her car, which can be fun and productive as much as cooking. Will Jin ever see it as fun?","car wash what better way to spend your only time off, if not doing absolutely nothing? You goes to prove her boyfriend wrong by washing her car, which can be fun and productive as much as cooking. will [MEMBER] ever see it as fun?",42,2,47
https://golemlab.eu/graph/20871272,37,one kiss is all it takes,"""Someone you trust?"" ""Hm?"" ""You said you want your first kiss to be with someone you trust."" You nod, ""Yeah,"" thinking he's going to ask you more about how you picture your first kiss, or maybe suggest someone you both know. But what he says completely catches you off guard. ""Do you trust me? """,2019-10-03,900,Teen And Up Audiences,F/M,Completed,CHEESY AF BUT IDC BECAUSE UWU | Cheesy | First Kiss | Fluff | Friends to Lovers | i'm so soft,Kim Seokjin | Jin/Reader,False,seokjin,{'seokjin'},"Title: one kiss is all it takes [SEP] Summary: ""Someone you trust?"" ""Hm?"" ""You said you want your first kiss to be with someone you trust."" You nod, ""Yeah,"" thinking he's going to ask you more about how you picture your first kiss, or maybe suggest someone you both know. But what he says completely catches you off guard. ""Do you trust me? """,set(),one kiss is all it takes,"""someone you trust?"" ""hm?"" ""you said you want your first kiss to be with someone you trust."" you nod, ""yeah,"" thinking he's going to ask you more about how you picture your first kiss, or maybe suggest someone you both know. but what he says completely catches you off guard. ""do you trust me? ""","Title: one kiss is all it takes [SEP] Summary: ""someone you trust?"" ""hm?"" ""you said you want your first kiss to be with someone you trust."" you nod, ""yeah,"" thinking he's going to ask you more about how you picture your first kiss, or maybe suggest someone you both know. but what he says completely catches you off guard. ""do you trust me? ""","one kiss is all it takes ""Someone you trust?"" ""Hm?"" ""You said you want your first kiss to be with someone you trust."" You nod, ""Yeah,"" thinking he's going to ask you more about how you picture your first kiss, or maybe suggest someone you both know. But what he says completely catches you off guard. ""Do you trust me? ""","one kiss is all it takes ""someone you trust?"" ""hm?"" ""you said you want your first kiss to be with someone you trust."" you nod, ""yeah,"" thinking he's going to ask you more about how you picture your first kiss, or maybe suggest someone you both know. but what he says completely catches you off guard. ""do you trust me? """,55,6,64
https://golemlab.eu/graph/6215941,36,Clarity,"A story in which the concept of soulmates is explored. Her high school boyfriend breaks up with her, shattering her heart and dreams of the future. Somehow, she finds a way to fight through and pick up the pieces, only to have her foundations shaken again, at the worst possible time. She has a choice now, the love she knows and trusts, or the missing piece of her soul- can she live without him? Word count ~ 15,000 (Complete)",2016-03-11,15327,Teen And Up Audiences,F/M,Completed,,"Kim Seokjin | Jin/Reader, Shin Hoseok | Wonho/Reader",True,seokjin,{'seokjin'},"Title: Clarity [SEP] Summary: A story in which the concept of soulmates is explored. Her high school boyfriend breaks up with her, shattering her heart and dreams of the future. Somehow, she finds a way to fight through and pick up the pieces, only to have her foundations shaken again, at the worst possible time. She has a choice now, the love she knows and trusts, or the missing piece of her soul- can she live without him? Word count ~ 15,000 (Complete)",set(),clarity,"a story in which the concept of soulmates is explored. her high school boyfriend breaks up with her, shattering her heart and dreams of the future. somehow, she finds a way to fight through and pick up the pieces, only to have her foundations shaken again, at the worst possible time. she has a choice now, the love she knows and trusts, or the missing piece of her soul- can she live without him? word count ~ 15,000 (complete)","Title: clarity [SEP] Summary: a story in which the concept of soulmates is explored. her high school boyfriend breaks up with her, shattering her heart and dreams of the future. somehow, she finds a way to fight through and pick up the pieces, only to have her foundations shaken again, at the worst possible time. she has a choice now, the love she knows and trusts, or the missing piece of her soul- can she live without him? word count ~ 15,000 (complete)","Clarity A story in which the concept of soulmates is explored. Her high school boyfriend breaks up with her, shattering her heart and dreams of the future. Somehow, she finds a way to fight through and pick up the pieces, only to have her foundations shaken again, at the worst possible time. She has a choice now, the love she knows and trusts, or the missing piece of her soul- can she live without him? Word count ~ 15,000 (Complete)","clarity a story in which the concept of soulmates is explored. her high school boyfriend breaks up with her, shattering her heart and dreams of the future. somehow, she finds a way to fight through and pick up the pieces, only to have her foundations shaken again, at the worst possible time. she has a choice now, the love she knows and trusts, or the missing piece of her soul- can she live without him? word count ~ 15,000 (complete)",79,1,83
https://golemlab.eu/graph/6381022,36,Strangers,"Type: Scenario Pairing: Seokjin, You Genre: Fluff Words: 572",2016-03-28,553,General Audiences,Gen,Completed,Fluff | One Shot | Scenario | imagine,Kim Seokjin | Jin/Reader Series: Scenarios [20],False,seokjin,{'seokjin'},"Title: Strangers [SEP] Summary: Type: Scenario Pairing: Seokjin, You Genre: Fluff Words: 572",set(),strangers,"type: scenario pairing: [MEMBER], you genre: fluff words: 572","Title: strangers [SEP] Summary: type: scenario pairing: [MEMBER], you genre: fluff words: 572","Strangers Type: Scenario Pairing: Seokjin, You Genre: Fluff Words: 572","strangers type: scenario pairing: [MEMBER], you genre: fluff words: 572",9,1,13
https://golemlab.eu/graph/21354292,36,Rainy Days,The rain has a way of putting you in a mood.,2019-11-08,2586,Explicit,F/M,Completed,Fluff and Smut,Kim Seokjin | Jin/Reader,False,seokjin,{'seokjin'},Title: Rainy Days [SEP] Summary: The rain has a way of putting you in a mood.,set(),rainy days,the rain has a way of putting you in a mood.,Title: rainy days [SEP] Summary: the rain has a way of putting you in a mood.,Rainy Days The rain has a way of putting you in a mood.,rainy days the rain has a way of putting you in a mood.,11,2,16
https://golemlab.eu/graph/18473410,36,dom jin,big long thing about what kind of dom jin is - see notes,2019-04-15,998,Mature,F/M,Completed,,Kim Seokjin | Jin/Reader,False,seokjin,{'seokjin'},Title: dom jin [SEP] Summary: big long thing about what kind of dom jin is - see notes,{'dom jin'},dom [MEMBER],big long thing about what kind of dom [MEMBER] is - see notes,Title: dom [MEMBER] [SEP] Summary: big long thing about what kind of dom [MEMBER] is - see notes,dom jin big long thing about what kind of dom jin is - see notes,dom [MEMBER] big long thing about what kind of dom [MEMBER] is - see notes,12,2,17
https://golemlab.eu/graph/21558883,36,definitely you,"money can buy you everything, well, not everything, it can’t buy love. seokjin had found that out and now he remained wifeless. little did he know he would find love where he least expected it.",2019-11-25,12263,Mature,F/M,Completed,Originally Posted on Tumblr | Rich Kim Seokjin | Jin | forbiden love i guess | reader is a baker | seokjin used to be poor tho | the kim line are the kim brothers in this one | they get a happy ending i promise,Kim Seokjin | Jin/Reader Series: the history of us [3],False,seokjin,{'seokjin'},"Title: definitely you [SEP] Summary: money can buy you everything, well, not everything, it can’t buy love. seokjin had found that out and now he remained wifeless. little did he know he would find love where he least expected it.",{'seokjin'},definitely you,"money can buy you everything, well, not everything, it can’t buy love. [MEMBER] had found that out and now he remained wifeless. little did he know he would find love where he least expected it.","Title: definitely you [SEP] Summary: money can buy you everything, well, not everything, it can’t buy love. [MEMBER] had found that out and now he remained wifeless. little did he know he would find love where he least expected it.","definitely you money can buy you everything, well, not everything, it can’t buy love. seokjin had found that out and now he remained wifeless. little did he know he would find love where he least expected it.","definitely you money can buy you everything, well, not everything, it can’t buy love. [MEMBER] had found that out and now he remained wifeless. little did he know he would find love where he least expected it.",36,2,41
https://golemlab.eu/graph/21419821,36,Clink,"Genre: Smut with Kim Seokjin x Female Reader Warnings: Restraint, metal cuffs, without giving too much away you’re restrained to something making you kneel before him. A really bad movie reference but it makes sense. Voyeurism (sort of). Summary: You finally get a glimpse of Jin taking his Dominating role at an unexpected time. Reference: I Feel Like I’m Drowning by Two Feet. Request: Baby wants attention. Baby wants that one *points at Seokjin * please kiki I’ve been good 🍼💦✨ @sweet-teeth-mfs Notes: As I’ve mentioned before, I personally feel Jin is quite a dominating character so this might not be how you see Jinnie. I’ve written him how I see him so I hope you like. All rights reserved ©Gotmetalkinginmysleep",2019-11-13,1133,Explicit,F/M,Completed,Begging | Bondage | Dom/sub | Male Solo | Oral Sex | Restraints | Voyeurism,Kim Seokjin | Jin/Reader,False,seokjin,{'seokjin'},"Title: Clink [SEP] Summary: Genre: Smut with Kim Seokjin x Female Reader Warnings: Restraint, metal cuffs, without giving too much away you’re restrained to something making you kneel before him. A really bad movie reference but it makes sense. Voyeurism (sort of). Summary: You finally get a glimpse of Jin taking his Dominating role at an unexpected time. Reference: I Feel Like I’m Drowning by Two Feet. Request: Baby wants attention. Baby wants that one *points at Seokjin * please kiki I’ve been good 🍼💦✨ @sweet-teeth-mfs Notes: As I’ve mentioned before, I personally feel Jin is quite a dominating character so this might not be how you see Jinnie. I’ve written him how I see him so I hope you like. All rights reserved ©Gotmetalkinginmysleep","{'Jin', 'Female Reader Warnings', 'Kim Seokjin', 'Jinnie', 'Restraint', 'Genre'}",clink,"genre: smut with [MEMBER] x female reader warnings: restraint, metal cuffs, without giving too much away you’re restrained to something making you kneel before him. a really bad movie reference but it makes sense. voyeurism (sort of). summary: you finally get a glimpse of [MEMBER] taking his dominating role at an unexpected time. reference: i feel like i’m drowning by two feet. request: baby wants attention. baby wants that one *points at [MEMBER] * please kiki i’ve been good 🍼💦✨ @sweet-teeth-mfs notes: as i’ve mentioned before, i personally feel [MEMBER] is quite a dominating character so this might not be how you see jinnie. i’ve written him how i see him so i [MEMBER] you like. all rights reserved ©gotmetalkinginmysleep","Title: clink [SEP] Summary: genre: smut with [MEMBER] x female reader warnings: restraint, metal cuffs, without giving too much away you’re restrained to something making you kneel before him. a really bad movie reference but it makes sense. voyeurism (sort of). summary: you finally get a glimpse of [MEMBER] taking his dominating role at an unexpected time. reference: i feel like i’m drowning by two feet. request: baby wants attention. baby wants that one *points at [MEMBER] * please kiki i’ve been good 🍼💦✨ @sweet-teeth-mfs notes: as i’ve mentioned before, i personally feel [MEMBER] is quite a dominating character so this might not be how you see jinnie. i’ve written him how i see him so i [MEMBER] you like. all rights reserved ©gotmetalkinginmysleep","Clink Genre: Smut with Kim Seokjin x Female Reader Warnings: Restraint, metal cuffs, without giving too much away you’re restrained to something making you kneel before him. A really bad movie reference but it makes sense. Voyeurism (sort of). Summary: You finally get a glimpse of Jin taking his Dominating role at an unexpected time. Reference: I Feel Like I’m Drowning by Two Feet. Request: Baby wants attention. Baby wants that one *points at Seokjin * please kiki I’ve been good 🍼💦✨ @sweet-teeth-mfs Notes: As I’ve mentioned before, I personally feel Jin is quite a dominating character so this might not be how you see Jinnie. I’ve written him how I see him so I hope you like. All rights reserved ©Gotmetalkinginmysleep","clink genre: smut with [MEMBER] x female reader warnings: restraint, metal cuffs, without giving too much away you’re restrained to something making you kneel before him. a really bad movie reference but it makes sense. voyeurism (sort of). summary: you finally get a glimpse of [MEMBER] taking his dominating role at an unexpected time. reference: i feel like i’m drowning by two feet. request: baby wants attention. baby wants that one *points at [MEMBER] * please kiki i’ve been good 🍼💦✨ @sweet-teeth-mfs notes: as i’ve mentioned before, i personally feel [MEMBER] is quite a dominating character so this might not be how you see jinnie. i’ve written him how i see him so i [MEMBER] you like. all rights reserved ©gotmetalkinginmysleep",125,1,129
https://golemlab.eu/graph/14765735,36,Eat Jin,Short and tasty,2018-05-27,203,Explicit,F/M,Completed,Food Kink | Smut,Kim Seokjin | Jin/Reader,False,seokjin,{'seokjin'},Title: Eat Jin [SEP] Summary: Short and tasty,{'Eat Jin'},eat [MEMBER],short and tasty,Title: eat [MEMBER] [SEP] Summary: short and tasty,Eat Jin Short and tasty,eat [MEMBER] short and tasty,3,2,8
https://golemlab.eu/graph/21419785,35,The Lift,"Genre: Implied smut and comedy with Seokjin x Female Reader (Y/N) Warnings: Spanking, reader is drunk, really bad jokes (not from Jin surprisingly), established relationship Summary: You have a free pass to go out with your friends instead of spending the night with Jin. However, being your ride home is a little more troublesome than he first thought. Reference: There’s Nothing Holdin’ Me Back by Shawn Mendes All rights reserved ©Gotmetalkinginmysleep",2019-11-13,900,Explicit,F/M,Completed,Biting | Comedy | Drunkenness | Spanking,Kim Seokjin | Jin/Reader,False,seokjin,{'seokjin'},"Title: The Lift [SEP] Summary: Genre: Implied smut and comedy with Seokjin x Female Reader (Y/N) Warnings: Spanking, reader is drunk, really bad jokes (not from Jin surprisingly), established relationship Summary: You have a free pass to go out with your friends instead of spending the night with Jin. However, being your ride home is a little more troublesome than he first thought. Reference: There’s Nothing Holdin’ Me Back by Shawn Mendes All rights reserved ©Gotmetalkinginmysleep","{'Shawn Mendes', 'Genre', 'Jin'}",the lift,"genre: implied smut and comedy with [MEMBER] x female reader (You) warnings: spanking, reader is drunk, really bad jokes (not from [MEMBER] surprisingly), established relationship summary: you have a free pass to go out with your friends instead of spending the night with [MEMBER]. however, being your ride home is a little more troublesome than he first thought. reference: there’s nothing holdin’ me back by shawn mendes all rights reserved ©gotmetalkinginmysleep","Title: the lift [SEP] Summary: genre: implied smut and comedy with [MEMBER] x female reader (You) warnings: spanking, reader is drunk, really bad jokes (not from [MEMBER] surprisingly), established relationship summary: you have a free pass to go out with your friends instead of spending the night with [MEMBER]. however, being your ride home is a little more troublesome than he first thought. reference: there’s nothing holdin’ me back by shawn mendes all rights reserved ©gotmetalkinginmysleep","The Lift Genre: Implied smut and comedy with Seokjin x Female Reader (Y/N) Warnings: Spanking, reader is drunk, really bad jokes (not from Jin surprisingly), established relationship Summary: You have a free pass to go out with your friends instead of spending the night with Jin. However, being your ride home is a little more troublesome than he first thought. Reference: There’s Nothing Holdin’ Me Back by Shawn Mendes All rights reserved ©Gotmetalkinginmysleep","the lift genre: implied smut and comedy with [MEMBER] x female reader (You) warnings: spanking, reader is drunk, really bad jokes (not from [MEMBER] surprisingly), established relationship summary: you have a free pass to go out with your friends instead of spending the night with [MEMBER]. however, being your ride home is a little more troublesome than he first thought. reference: there’s nothing holdin’ me back by shawn mendes all rights reserved ©gotmetalkinginmysleep",72,2,77
https://golemlab.eu/graph/39147801,35,fwb with bts ♡ jin,how jin becomes your friend with benefits,2022-05-22,1030,Explicit,F/M,Completed,Cunnilingus | Fingering | Friends to Lovers | Smut | Unprotected Sex | jin is a bit whipped | non-idol!au,Kim Seokjin | Jin/Reader Series: friends with benefits with bts [1],False,seokjin,{'seokjin'},Title: fwb with bts ♡ jin [SEP] Summary: how jin becomes your friend with benefits,{'jin'},fwb with bts ♡ [MEMBER],how [MEMBER] becomes your friend with benefits,Title: fwb with bts ♡ [MEMBER] [SEP] Summary: how [MEMBER] becomes your friend with benefits,fwb with bts ♡ jin how jin becomes your friend with benefits,fwb with bts ♡ [MEMBER] how [MEMBER] becomes your friend with benefits,7,4,14
https://golemlab.eu/graph/26782240,35,Amaretto Sour,"Hongdae nights, alcoholic drinks, and last-minute decisions - these are a few of your favorite things.",2020-10-03,12374,Explicit,F/M,Completed,Biting | Copious amounts of snarky flirting | Marking | Narcissistic!Jin | Rough Kissing | Rough Sex | Smoker!Jin | Tattooed!Jin | dirty words | lots and lots of alcohol | love motels,Kim Seokjin | Jin/Reader,False,seokjin,{'seokjin'},"Title: Amaretto Sour [SEP] Summary: Hongdae nights, alcoholic drinks, and last-minute decisions - these are a few of your favorite things.",{'Amaretto Sour'},amaretto sour,"hongdae nights, alcoholic drinks, and last-minute decisions - these are a few of your favorite things.","Title: amaretto sour [SEP] Summary: hongdae nights, alcoholic drinks, and last-minute decisions - these are a few of your favorite things.","Amaretto Sour Hongdae nights, alcoholic drinks, and last-minute decisions - these are a few of your favorite things.","amaretto sour hongdae nights, alcoholic drinks, and last-minute decisions - these are a few of your favorite things.",16,2,21
