s,kudos,title,summary,datePublished,words,rating,romanticCategory,publicationStatus,keyword,relationship,polyship_human_flag,member,members_found,combined_text,ner_persons,title_masked,summary_masked,combined_text_masked,modela_text_raw,modelb_text_masked,summary_masked_length,title_masked_length,combined_text_masked_length
https://golemlab.eu/graph/11561037,75,A Language All Our Own,"‘I can’t believe it, I’m actually here. This is actually happening.’ You meet Jin at BTS's first fansign, things don't go quite how they should have, but that's okay. Actions speak louder than words.",2017-08-14,1921,General Audiences,F/M,Completed,#heartsforjin | Ambiguous/Open Ending | Fluff | I love him | Light Angst | Meet-Cute | One Shot | Reader-Insert | Short & Sweet | fanmeetings | im trash | lowkey only wrote this cuz im whipped for Jin | other members appear briefly - Freeform | thank you Rei,Kim Seokjin | Jin/Reader,False,seokjin,{'seokjin'},"Title: A Language All Our Own [SEP] Summary: ‘I can’t believe it, I’m actually here. This is actually happening.’ You meet Jin at BTS's first fansign, things don't go quite how they should have, but that's okay. Actions speak louder than words.",{'Jin'},a language all our own,"‘i can’t believe it, i’m actually here. this is actually happening.’ you meet [MEMBER] at bts's first fansign, things don't go quite how they should have, but that's okay. actions speak louder than words.","Title: a language all our own [SEP] Summary: ‘i can’t believe it, i’m actually here. this is actually happening.’ you meet [MEMBER] at bts's first fansign, things don't go quite how they should have, but that's okay. actions speak louder than words.","A Language All Our Own ‘I can’t believe it, I’m actually here. This is actually happening.’ You meet Jin at BTS's first fansign, things don't go quite how they should have, but that's okay. Actions speak louder than words.","a language all our own ‘i can’t believe it, i’m actually here. this is actually happening.’ you meet [MEMBER] at bts's first fansign, things don't go quite how they should have, but that's okay. actions speak louder than words.",39,5,47
https://golemlab.eu/graph/6611560,75,Voix,He misses you. And all he needs is to hear the sound of your voice to keep moving on.,2016-04-21,3419,Teen And Up Audiences,F/M,Completed,Angst | Heavy Angst,Kim Seokjin | Jin/Reader,False,seokjin,{'seokjin'},Title: Voix [SEP] Summary: He misses you. And all he needs is to hear the sound of your voice to keep moving on.,set(),voix,he misses you. and all he needs is to hear the sound of your voice to keep moving on.,Title: voix [SEP] Summary: he misses you. and all he needs is to hear the sound of your voice to keep moving on.,Voix He misses you. And all he needs is to hear the sound of your voice to keep moving on.,voix he misses you. and all he needs is to hear the sound of your voice to keep moving on.,19,1,23
https://golemlab.eu/graph/13499478,75,Cave Me In,Four hours remain before he leaves for tour and you decide to make it count,2018-01-28,6153,Mature,F/M,Completed,Fluff | Idols | Light Dirty Talk | Light Hair Pulling | Oral Sex | Romance | Smut | Vaginal Fingering,Kim Seokjin | Jin/Reader,False,seokjin,{'seokjin'},Title: Cave Me In [SEP] Summary: Four hours remain before he leaves for tour and you decide to make it count,set(),cave me in,four hours remain before he leaves for tour and you decide to make it count,Title: cave me in [SEP] Summary: four hours remain before he leaves for tour and you decide to make it count,Cave Me In Four hours remain before he leaves for tour and you decide to make it count,cave me in four hours remain before he leaves for tour and you decide to make it count,15,3,21
https://golemlab.eu/graph/25223359,75,Always Trust In Pixie Dust,"As a vegetable pixie, you weren’t exactly considered the most desirable in the pixie hierarchy. But the uncle of one of your student’s is convinced that you have a secret admirer, only made worse when your younger brother and sister get involved. Will they succeed in their matchmaking or will your admirer come forward before they can get into too much mischief?",2020-07-12,13977,Teen And Up Audiences,F/M,Completed,Fantasy AU | Fluff | Pixie AU | Supernatural AU - Freeform | pixie jimin | pixie jin | pixie reader | pixie taehyung | slight angst,Kim Seokjin | Jin/Reader,False,seokjin,{'seokjin'},"Title: Always Trust In Pixie Dust [SEP] Summary: As a vegetable pixie, you weren’t exactly considered the most desirable in the pixie hierarchy. But the uncle of one of your student’s is convinced that you have a secret admirer, only made worse when your younger brother and sister get involved. Will they succeed in their matchmaking or will your admirer come forward before they can get into too much mischief?",set(),always trust in pixie dust,"as a vegetable pixie, you weren’t exactly considered the most desirable in the pixie hierarchy. but the uncle of one of your student’s is convinced that you have a secret admirer, only made worse when your younger brother and sister get involved. will they succeed in their matchmaking or will your admirer come forward before they can get into too much mischief?","Title: always trust in pixie dust [SEP] Summary: as a vegetable pixie, you weren’t exactly considered the most desirable in the pixie hierarchy. but the uncle of one of your student’s is convinced that you have a secret admirer, only made worse when your younger brother and sister get involved. will they succeed in their matchmaking or will your admirer come forward before they can get into too much mischief?","Always Trust In Pixie Dust As a vegetable pixie, you weren’t exactly considered the most desirable in the pixie hierarchy. But the uncle of one of your student’s is convinced that you have a secret admirer, only made worse when your younger brother and sister get involved. Will they succeed in their matchmaking or will your admirer come forward before they can get into too much mischief?","always trust in pixie dust as a vegetable pixie, you weren’t exactly considered the most desirable in the pixie hierarchy. but the uncle of one of your student’s is convinced that you have a secret admirer, only made worse when your younger brother and sister get involved. will they succeed in their matchmaking or will your admirer come forward before they can get into too much mischief?",64,5,72
https://golemlab.eu/graph/28164459,74,Last Christmas,"it was bound to happen, eventually. after months of near misses at barbecues and birthdays, there’s no avoiding your ex-husband at hoseok’s annual christmas bash. but it’s fine, totally fine, because you’re both adults – and you’ve both brought dates and booze. what could go wrong?",2020-12-19,9010,Mature,F/M,Completed,Bad Manners | Emotional Constipation | Exes to Lovers | Snark | Snarky Smut | So Much Snark | Unprotected Sex | and a partridge in a pear tree | angelic!namjoon | bickering during banging | inconsiderate behavior | instigator!yoongi | neurotic!hoseok | sniping during smutting | terrible accounting jokes,"Kim Seokjin | Jin/Reader, Kim Seokjin | Jin/You",False,seokjin,{'seokjin'},"Title: Last Christmas [SEP] Summary: it was bound to happen, eventually. after months of near misses at barbecues and birthdays, there’s no avoiding your ex-husband at hoseok’s annual christmas bash. but it’s fine, totally fine, because you’re both adults – and you’ve both brought dates and booze. what could go wrong?",set(),last christmas,"it was bound to happen, eventually. after months of near misses at barbecues and birthdays, there’s no avoiding your ex-husband at [MEMBER] annual christmas bash. but it’s fine, totally fine, because you’re both adults – and you’ve both brought dates and booze. what could go wrong?","Title: last christmas [SEP] Summary: it was bound to happen, eventually. after months of near misses at barbecues and birthdays, there’s no avoiding your ex-husband at [MEMBER] annual christmas bash. but it’s fine, totally fine, because you’re both adults – and you’ve both brought dates and booze. what could go wrong?","Last Christmas it was bound to happen, eventually. after months of near misses at barbecues and birthdays, there’s no avoiding your ex-husband at hoseok’s annual christmas bash. but it’s fine, totally fine, because you’re both adults – and you’ve both brought dates and booze. what could go wrong?","last christmas it was bound to happen, eventually. after months of near misses at barbecues and birthdays, there’s no avoiding your ex-husband at [MEMBER] annual christmas bash. but it’s fine, totally fine, because you’re both adults – and you’ve both brought dates and booze. what could go wrong?",50,2,55
https://golemlab.eu/graph/29246514,74,Midnight,"Unable to sleep, your boyfriend gives you a little midnight relief.",2021-02-06,1440,Explicit,F/M,Completed,Boyfriend Seokjin | Creampie | Hair-pulling | Hickeys | Kim Seokjin | Jin Smut | Marking | Scratching | Unprotected Sex | Vaginal Fingering,Kim Seokjin | Jin/Reader,False,seokjin,{'seokjin'},"Title: Midnight [SEP] Summary: Unable to sleep, your boyfriend gives you a little midnight relief.",set(),midnight,"unable to sleep, your boyfriend gives you a little midnight relief.","Title: midnight [SEP] Summary: unable to sleep, your boyfriend gives you a little midnight relief.","Midnight Unable to sleep, your boyfriend gives you a little midnight relief.","midnight unable to sleep, your boyfriend gives you a little midnight relief.",11,1,15
https://golemlab.eu/graph/6768190,74,Hanker Sore,I hated him. He was so goddamn attractive. He was beautiful. He was practically perfect. I liked him.,2016-05-06,2405,General Audiences,F/M,Completed,mentions of yoongi,Kim Seokjin | Jin/Reader,False,seokjin,{'seokjin'},Title: Hanker Sore [SEP] Summary: I hated him. He was so goddamn attractive. He was beautiful. He was practically perfect. I liked him.,set(),hanker sore,i hated him. he was so goddamn attractive. he was beautiful. he was practically perfect. i liked him.,Title: hanker sore [SEP] Summary: i hated him. he was so goddamn attractive. he was beautiful. he was practically perfect. i liked him.,Hanker Sore I hated him. He was so goddamn attractive. He was beautiful. He was practically perfect. I liked him.,hanker sore i hated him. he was so goddamn attractive. he was beautiful. he was practically perfect. i liked him.,18,2,23
https://golemlab.eu/graph/17401397,74,A Helping Hand,"Sexually frustrated, Jin offers you a hand.",2019-01-13,2941,Explicit,F/M,Completed,Alcohol | Friends to Lovers | Marking | Oral Sex | Vaginal Fingering,Kim Seokjin | Jin/Reader,False,seokjin,{'seokjin'},"Title: A Helping Hand [SEP] Summary: Sexually frustrated, Jin offers you a hand.",{'Jin'},a helping hand,"sexually frustrated, [MEMBER] offers you a hand.","Title: a helping hand [SEP] Summary: sexually frustrated, [MEMBER] offers you a hand.","A Helping Hand Sexually frustrated, Jin offers you a hand.","a helping hand sexually frustrated, [MEMBER] offers you a hand.",7,3,13
https://golemlab.eu/graph/18384503,74,Jealousy,"You’re happily married to Seokjin, for the most part, but seeing him co-host M Countdown with the gorgeous Jennie from BLACKPINK makes you feel entirely insecure and you don’t know how to deal with it.",2019-04-07,2029,Mature,F/M,Completed,Angst with a Happy Ending | Jealousy | Seokjin is DADDY | a little bit angsty but mainly fluff | bts canon | but he is also HUBBIE | spoiler alert lol,Kim Seokjin | Jin/Reader,False,seokjin,{'seokjin'},"Title: Jealousy [SEP] Summary: You’re happily married to Seokjin, for the most part, but seeing him co-host M Countdown with the gorgeous Jennie from BLACKPINK makes you feel entirely insecure and you don’t know how to deal with it.",{'Jennie'},jealousy,"you’re happily married to [MEMBER], for the most part, but seeing him co-host m countdown with the gorgeous jennie from blackpink makes you feel entirely insecure and you don’t know how to deal with it.","Title: jealousy [SEP] Summary: you’re happily married to [MEMBER], for the most part, but seeing him co-host m countdown with the gorgeous jennie from blackpink makes you feel entirely insecure and you don’t know how to deal with it.","Jealousy You’re happily married to Seokjin, for the most part, but seeing him co-host M Countdown with the gorgeous Jennie from BLACKPINK makes you feel entirely insecure and you don’t know how to deal with it.","jealousy you’re happily married to [MEMBER], for the most part, but seeing him co-host m countdown with the gorgeous jennie from blackpink makes you feel entirely insecure and you don’t know how to deal with it.",38,1,42
https://golemlab.eu/graph/21809275,74,Mistakes and Retakes,"You hate to admit it, but making bad decisions and being reckless seem to be your forte. From saying yes to a last minute meeting to ignoring your father’s warning about driving late at night on a slippery road. As if you haven’t gotten enough bad luck already, your high school nemesis decides to be a hero and comes to the rescue. Santa must have placed you in his naughty list for a dire punishment before Christmas.",2019-12-16,18601,Mature,F/M,Completed,Enemies to Lovers | Fluff and Angst | Fluff and Smut | Outdoor Sex | Romance | Romantic Comedy | Smut | Winter | stranded for christmas,Kim Seokjin | Jin/Reader,False,seokjin,{'seokjin'},"Title: Mistakes and Retakes [SEP] Summary: You hate to admit it, but making bad decisions and being reckless seem to be your forte. From saying yes to a last minute meeting to ignoring your father’s warning about driving late at night on a slippery road. As if you haven’t gotten enough bad luck already, your high school nemesis decides to be a hero and comes to the rescue. Santa must have placed you in his naughty list for a dire punishment before Christmas.",set(),mistakes and retakes,"you hate to admit it, but making bad decisions and being reckless seem to be your forte. from saying yes to a last minute meeting to ignoring your father’s warning about driving late at night on a slippery road. as if you haven’t gotten enough bad luck already, your high school nemesis decides to be a hero and comes to the rescue. santa must have placed you in his naughty list for a dire punishment before christmas.","Title: mistakes and retakes [SEP] Summary: you hate to admit it, but making bad decisions and being reckless seem to be your forte. from saying yes to a last minute meeting to ignoring your father’s warning about driving late at night on a slippery road. as if you haven’t gotten enough bad luck already, your high school nemesis decides to be a hero and comes to the rescue. santa must have placed you in his naughty list for a dire punishment before christmas.","Mistakes and Retakes You hate to admit it, but making bad decisions and being reckless seem to be your forte. From saying yes to a last minute meeting to ignoring your father’s warning about driving late at night on a slippery road. As if you haven’t gotten enough bad luck already, your high school nemesis decides to be a hero and comes to the rescue. Santa must have placed you in his naughty list for a dire punishment before Christmas.","mistakes and retakes you hate to admit it, but making bad decisions and being reckless seem to be your forte. from saying yes to a last minute meeting to ignoring your father’s warning about driving late at night on a slippery road. as if you haven’t gotten enough bad luck already, your high school nemesis decides to be a hero and comes to the rescue. santa must have placed you in his naughty list for a dire punishment before christmas.",79,3,85
https://golemlab.eu/graph/14773850,73,Favourite Kim Seokjin,"It’s either your favourite stuffed alpaca, Kim Seokjin or your favourite boyfriend, Kim Seokjin.",2018-05-28,684,General Audiences,F/M,Completed,Fluffy jin | Jin is too sweet | Kim Seokjin - Freeform | bangtan - Freeform | bts - Freeform | i kinda wanna gag because Jin is so cute | sleepy boyfriend | soft,"Kim Seokjin | Jin/Reader, Kim Seokjin/Reader",False,seokjin,{'seokjin'},"Title: Favourite Kim Seokjin [SEP] Summary: It’s either your favourite stuffed alpaca, Kim Seokjin or your favourite boyfriend, Kim Seokjin.",{'Kim Seokjin'},favourite [MEMBER],"it’s either your favourite stuffed alpaca, [MEMBER] or your favourite boyfriend, [MEMBER].","Title: favourite [MEMBER] [SEP] Summary: it’s either your favourite stuffed alpaca, [MEMBER] or your favourite boyfriend, [MEMBER].","Favourite Kim Seokjin It’s either your favourite stuffed alpaca, Kim Seokjin or your favourite boyfriend, Kim Seokjin.","favourite [MEMBER] it’s either your favourite stuffed alpaca, [MEMBER] or your favourite boyfriend, [MEMBER].",13,2,18
https://golemlab.eu/graph/12510528,73,|ＮＯＴ  Ａ  ＳＯＵＮＤ |,a/n: Based on a dream I had,2017-10-27,2965,Mature,F/M,Completed,Bangtan smut | Cunnilingus | Sex | Smut | bts jin smut | bts smut,Kim Seokjin | Jin/Reader,False,seokjin,{'seokjin'},Title: |ＮＯＴ  Ａ  ＳＯＵＮＤ | [SEP] Summary: a/n: Based on a dream I had,set(),|ｎｏｔ  ａ  ｓｏｕｎｄ |,a/n: based on a dream i had,Title: |ｎｏｔ  ａ  ｓｏｕｎｄ | [SEP] Summary: a/n: based on a dream i had,|ＮＯＴ  Ａ  ＳＯＵＮＤ | a/n: Based on a dream I had,|ｎｏｔ  ａ  ｓｏｕｎｄ | a/n: based on a dream i had,8,3,14
https://golemlab.eu/graph/22730593,73,Bespoke,Two one shots of Jin smut where he's behind bespoke luxury items and even better dicking From Lace: His ad stuck out. Independent lingerie maker in search of model and muse. Bespoke: Jin is a perfumer that crafts custom scents.,2020-02-15,9070,Explicit,F/M,Completed,Blindfolds | Creampie | Cum Play | Dirty Talk | Dom Kim Seokjin | Jin | Dom/sub | Fingerfucking | Lingerie | Marking | Oral Sex | Restraints | Sensation Play | Shameless Smut | Spanking | Vaginal Sex,Kim Seokjin | Jin/Reader,False,seokjin,{'seokjin'},Title: Bespoke [SEP] Summary: Two one shots of Jin smut where he's behind bespoke luxury items and even better dicking From Lace: His ad stuck out. Independent lingerie maker in search of model and muse. Bespoke: Jin is a perfumer that crafts custom scents.,"{'Jin', 'Lace'}",bespoke,two one shots of [MEMBER] smut where he's behind bespoke luxury items and even better dicking from lace: his ad stuck out. independent lingerie maker in search of model and muse. bespoke: [MEMBER] is a perfumer that crafts custom scents.,Title: bespoke [SEP] Summary: two one shots of [MEMBER] smut where he's behind bespoke luxury items and even better dicking from lace: his ad stuck out. independent lingerie maker in search of model and muse. bespoke: [MEMBER] is a perfumer that crafts custom scents.,Bespoke Two one shots of Jin smut where he's behind bespoke luxury items and even better dicking From Lace: His ad stuck out. Independent lingerie maker in search of model and muse. Bespoke: Jin is a perfumer that crafts custom scents.,bespoke two one shots of [MEMBER] smut where he's behind bespoke luxury items and even better dicking from lace: his ad stuck out. independent lingerie maker in search of model and muse. bespoke: [MEMBER] is a perfumer that crafts custom scents.,41,1,45
https://golemlab.eu/graph/35499955,73,Cinnamon Bliss,"Ever since the day he walked through the front door of your cafe hand in hand with his sweet daughter on one gloomy afternoon in the middle of winter, he had captured your heart without him even knowing it. All the time, you had chosen to stay on the sidelines, watching him mend his broken heart in silence while he teaches his own daughter that it was okay to be a kid despite the pain that they shared. You know you shouldn’t be so infatuated with him or let this feeling go any deeper. Because nothing could prepare you when you are forced to watch him move on, completely unaware that he is about to be breaking your heart into pieces.",2021-12-04,55338,Mature,F/M,In-Progress,Angst | Angst and Hurt/Comfort | Angst with a Happy Ending | Body Worship | Cafe Owner Reader | Eventual Smut | Explicit Sexual Content | Foreplay | Grief/Mourning | Healing | Kissing | Major Character Injury | Minor Character Death | Single Parent Kim Seokjin | Jin | Trauma | Unprotected Sex | Unrequited Love | Vanilla,Kim Seokjin | Jin/Reader,False,seokjin,{'seokjin'},"Title: Cinnamon Bliss [SEP] Summary: Ever since the day he walked through the front door of your cafe hand in hand with his sweet daughter on one gloomy afternoon in the middle of winter, he had captured your heart without him even knowing it. All the time, you had chosen to stay on the sidelines, watching him mend his broken heart in silence while he teaches his own daughter that it was okay to be a kid despite the pain that they shared. You know you shouldn’t be so infatuated with him or let this feeling go any deeper. Because nothing could prepare you when you are forced to watch him move on, completely unaware that he is about to be breaking your heart into pieces.",{'Cinnamon Bliss'},cinnamon bliss,"ever since the day he walked through the front door of your cafe hand in hand with his sweet daughter on one gloomy afternoon in the middle of winter, he had captured your heart without him even knowing it. all the time, you had chosen to stay on the sidelines, watching him mend his broken heart in silence while he teaches his own daughter that it was okay to be a kid despite the pain that they shared. you know you shouldn’t be so infatuated with him or let this feeling go any deeper. because nothing could prepare you when you are forced to watch him move on, completely unaware that he is about to be breaking your heart into pieces.","Title: cinnamon bliss [SEP] Summary: ever since the day he walked through the front door of your cafe hand in hand with his sweet daughter on one gloomy afternoon in the middle of winter, he had captured your heart without him even knowing it. all the time, you had chosen to stay on the sidelines, watching him mend his broken heart in silence while he teaches his own daughter that it was okay to be a kid despite the pain that they shared. you know you shouldn’t be so infatuated with him or let this feeling go any deeper. because nothing could prepare you when you are forced to watch him move on, completely unaware that he is about to be breaking your heart into pieces.","Cinnamon Bliss Ever since the day he walked through the front door of your cafe hand in hand with his sweet daughter on one gloomy afternoon in the middle of winter, he had captured your heart without him even knowing it. All the time, you had chosen to stay on the sidelines, watching him mend his broken heart in silence while he teaches his own daughter that it was okay to be a kid despite the pain that they shared. You know you shouldn’t be so infatuated with him or let this feeling go any deeper. Because nothing could prepare you when you are forced to watch him move on, completely unaware that he is about to be breaking your heart into pieces.","cinnamon bliss ever since the day he walked through the front door of your cafe hand in hand with his sweet daughter on one gloomy afternoon in the middle of winter, he had captured your heart without him even knowing it. all the time, you had chosen to stay on the sidelines, watching him mend his broken heart in silence while he teaches his own daughter that it was okay to be a kid despite the pain that they shared. you know you shouldn’t be so infatuated with him or let this feeling go any deeper. because nothing could prepare you when you are forced to watch him move on, completely unaware that he is about to be breaking your heart into pieces.",122,2,127
https://golemlab.eu/graph/25081279,72,Come Home -Jin x Reader-,"Tonight, Jin finally comes home.",2020-07-05,1207,General Audiences,F/M,Completed,Angst | Emotional Hurt/Comfort | Established Relationship | Fluff | Idol Kim Seokjin | Jin | Jin makes 2 puns at the end | One-Shot | Only a tiny bit is angsty I promise | general tooth-rotting fluff,Kim Seokjin | Jin/Reader,False,seokjin,{'seokjin'},"Title: Come Home -Jin x Reader- [SEP] Summary: Tonight, Jin finally comes home.",{'Jin'},come home -[MEMBER] x reader-,"tonight, [MEMBER] finally comes home.","Title: come home -[MEMBER] x reader- [SEP] Summary: tonight, [MEMBER] finally comes home.","Come Home -Jin x Reader- Tonight, Jin finally comes home.","come home -[MEMBER] x reader- tonight, [MEMBER] finally comes home.",5,5,13
https://golemlab.eu/graph/18102842,72,Radiant,You’re the one who was left behind.,2019-03-13,2162,Teen And Up Audiences,F/M,Completed,Angst | Fluff,Kim Seokjin | Jin/Reader,False,seokjin,{'seokjin'},Title: Radiant [SEP] Summary: You’re the one who was left behind.,set(),radiant,you’re the one who was left behind.,Title: radiant [SEP] Summary: you’re the one who was left behind.,Radiant You’re the one who was left behind.,radiant you’re the one who was left behind.,8,1,12
