s,kudos,title,summary,datePublished,words,rating,romanticCategory,publicationStatus,keyword,relationship,polyship_human_flag,member,members_found,combined_text,ner_persons,title_masked,summary_masked,combined_text_masked,modela_text_raw,modelb_text_masked,summary_masked_length,title_masked_length,combined_text_masked_length
https://golemlab.eu/graph/24438223,16,Pocky No I. (Kim Seokjin/Jin x F!Reader),"While  they are preparing a cake for their bandmates, Kim Seokjin can't help but be in awe with the fact that his girlfriend bought Pocky for the cakes decor. After all he's still waiting for a rematch from their last try on the Pocky-Game.",2020-05-29,1527,Teen And Up Audiences,F/M,Completed,Baking | Cake | Gentle Kissing | Kim Seokjin | Jin is a Sweetheart | Kissing | Making Out | Mentioned Kim Namjoon | RM | Sweet | Sweet Kim Seokjin | Jin | Teasing | The Pocky Game,Kim Seokjin | Jin/Reader Series: Pocky-Series [1],False,seokjin,{'seokjin'},"Title: Pocky No I. (Kim Seokjin/Jin x F!Reader) [SEP] Summary: While  they are preparing a cake for their bandmates, Kim Seokjin can't help but be in awe with the fact that his girlfriend bought Pocky for the cakes decor. After all he's still waiting for a rematch from their last try on the Pocky-Game.","{'Kim Seokjin', 'Pocky', 'Kim Seokjin/Jin x F!Reader'}",pocky no i. ([MEMBER]/[MEMBER] x f!reader),"while  they are preparing a cake for their bandmates, [MEMBER] can't help but be in awe with the fact that his girlfriend bought pocky for the cakes decor. after all he's still waiting for a rematch from their last try on the pocky-game.","Title: pocky no i. ([MEMBER]/[MEMBER] x f!reader) [SEP] Summary: while  they are preparing a cake for their bandmates, [MEMBER] can't help but be in awe with the fact that his girlfriend bought pocky for the cakes decor. after all he's still waiting for a rematch from their last try on the pocky-game.","Pocky No I. (Kim Seokjin/Jin x F!Reader) While  they are preparing a cake for their bandmates, Kim Seokjin can't help but be in awe with the fact that his girlfriend bought Pocky for the cakes decor. After all he's still waiting for a rematch from their last try on the Pocky-Game.","pocky no i. ([MEMBER]/[MEMBER] x f!reader) while  they are preparing a cake for their bandmates, [MEMBER] can't help but be in awe with the fact that his girlfriend bought pocky for the cakes decor. after all he's still waiting for a rematch from their last try on the pocky-game.",46,8,57
https://golemlab.eu/graph/12918222,16,"Baby, it's cold outside","Jin is baking gingerbread men, you are decorating the tree, and then you realize something.",2017-12-05,441,General Audiences,Other,Completed,Christmas | Fluff | Gender Neutral | It's Soft | yeah that's pretty much it tbh,Kim Seokjin | Jin/Reader Series: cassie_baby's bts drabbles [3],False,seokjin,{'seokjin'},"Title: Baby, it's cold outside [SEP] Summary: Jin is baking gingerbread men, you are decorating the tree, and then you realize something.",{'Jin'},"baby, it's cold outside","[MEMBER] is baking gingerbread men, you are decorating the tree, and then you realize something.","Title: baby, it's cold outside [SEP] Summary: [MEMBER] is baking gingerbread men, you are decorating the tree, and then you realize something.","Baby, it's cold outside Jin is baking gingerbread men, you are decorating the tree, and then you realize something.","baby, it's cold outside [MEMBER] is baking gingerbread men, you are decorating the tree, and then you realize something.",15,5,23
https://golemlab.eu/graph/17098763,16,"Snowfall, a Winter's Tale","Based off the prompt: “Are you ready to go - wait holy shit is something burning are you alright? Whoa, that’s embarrassing, no I’m not laughing. We’ve got time, let’s fix this”",2018-12-22,3754,Mature,F/M,In-Progress,Alternate Universe - College/University | Can't cook for shit | Dad Jokes | Domestic Fluff | Fluff and Humor | Friends to Lovers | Holidays | Karaoke | Rated M for language | These jokes are so bad | Winter | and some steamy moments later | but mostly language and alcohol | seriously you've been warned | terrible puns,Kim Seokjin | Jin/Reader Series: University AU [2],False,seokjin,{'seokjin'},"Title: Snowfall, a Winter's Tale [SEP] Summary: Based off the prompt: “Are you ready to go - wait holy shit is something burning are you alright? Whoa, that’s embarrassing, no I’m not laughing. We’ve got time, let’s fix this”",set(),"snowfall, a winter's tale","based off the prompt: “are you ready to go - wait holy shit is something burning are you alright? whoa, that’s embarrassing, no i’m not laughing. we’ve got time, let’s fix this”","Title: snowfall, a winter's tale [SEP] Summary: based off the prompt: “are you ready to go - wait holy shit is something burning are you alright? whoa, that’s embarrassing, no i’m not laughing. we’ve got time, let’s fix this”","Snowfall, a Winter's Tale Based off the prompt: “Are you ready to go - wait holy shit is something burning are you alright? Whoa, that’s embarrassing, no I’m not laughing. We’ve got time, let’s fix this”","snowfall, a winter's tale based off the prompt: “are you ready to go - wait holy shit is something burning are you alright? whoa, that’s embarrassing, no i’m not laughing. we’ve got time, let’s fix this”",35,5,43
https://golemlab.eu/graph/19178344,16,"Teacher, Teacher","in which kim seokjin is not a dumbass, math is just something only weird people get the hang of.",2019-06-11,8407,Teen And Up Audiences,F/M,In-Progress,Alcohol | Alternate Universe - Not K-Pop Idols | But so is everyone else | Cute Kim Seokjin | Jin | Partying | Popularity | Tutoring | future smut | im not glorifying popular culture oop | jimin is an f boy,Kim Seokjin | Jin/Reader,False,seokjin,{'seokjin'},"Title: Teacher, Teacher [SEP] Summary: in which kim seokjin is not a dumbass, math is just something only weird people get the hang of.",{'kim seokjin'},"teacher, teacher","in which [MEMBER] is not a dumbass, math is just something only weird people get the hang of.","Title: teacher, teacher [SEP] Summary: in which [MEMBER] is not a dumbass, math is just something only weird people get the hang of.","Teacher, Teacher in which kim seokjin is not a dumbass, math is just something only weird people get the hang of.","teacher, teacher in which [MEMBER] is not a dumbass, math is just something only weird people get the hang of.",18,2,23
https://golemlab.eu/graph/24847522,16,Scary Movie Night,You have had a crush on Jin ever since Jungkook introduced you to him. What happens when you and Jungkook play a prank on the other boys. Will Jin forgive you or will you be punished?,2020-06-21,3685,Mature,F/M,Completed,Dom Kim Seokjin | Jin | Fluff and Smut | Funny | Jeon Jungkook is a Little Shit | Smut,Kim Seokjin | Jin/Reader,False,seokjin,{'seokjin'},Title: Scary Movie Night [SEP] Summary: You have had a crush on Jin ever since Jungkook introduced you to him. What happens when you and Jungkook play a prank on the other boys. Will Jin forgive you or will you be punished?,"{'Jin', 'Will Jin'}",scary movie night,you have had a crush on [MEMBER] ever since [MEMBER] introduced you to him. what happens when you and [MEMBER] play a prank on the other boys. will [MEMBER] forgive you or will you be punished?,Title: scary movie night [SEP] Summary: you have had a crush on [MEMBER] ever since [MEMBER] introduced you to him. what happens when you and [MEMBER] play a prank on the other boys. will [MEMBER] forgive you or will you be punished?,Scary Movie Night You have had a crush on Jin ever since Jungkook introduced you to him. What happens when you and Jungkook play a prank on the other boys. Will Jin forgive you or will you be punished?,scary movie night you have had a crush on [MEMBER] ever since [MEMBER] introduced you to him. what happens when you and [MEMBER] play a prank on the other boys. will [MEMBER] forgive you or will you be punished?,36,3,42
https://golemlab.eu/graph/24192946,16,PANCAKE,Mornings with Seokjin and you as his wife.,2020-05-15,344,General Audiences,F/M,Completed,Domestic Fluff | Fluff | Married Life | Tooth-Rotting Fluff,Kim Seokjin | Jin/Reader,False,seokjin,{'seokjin'},Title: PANCAKE [SEP] Summary: Mornings with Seokjin and you as his wife.,set(),pancake,mornings with [MEMBER] and you as his wife.,Title: pancake [SEP] Summary: mornings with [MEMBER] and you as his wife.,PANCAKE Mornings with Seokjin and you as his wife.,pancake mornings with [MEMBER] and you as his wife.,8,1,12
https://golemlab.eu/graph/21515542,16,Hot Pot,"You really didn't want to be at the party despite that it was your best friend who was throwing it, who would have thought that it would end up the best night of your life though when a toilet paper mummy comes to save your night and take you out to eat instead.",2019-11-21,907,General Audiences,F/M,Completed,Alternate Universe - College/University | Crushes | Fluff | Getting Together | Halloween Costumes | Jin Is A Gentleman | halloween party,Kim Seokjin | Jin/Reader Series: #BTSCampfireStories [1],False,seokjin,{'seokjin'},"Title: Hot Pot [SEP] Summary: You really didn't want to be at the party despite that it was your best friend who was throwing it, who would have thought that it would end up the best night of your life though when a toilet paper mummy comes to save your night and take you out to eat instead.",set(),hot pot,"you really didn't want to be at the party despite that it was your best friend who was throwing it, who would have thought that it would end up the best night of your life though when a toilet paper mummy comes to save your night and take you out to eat instead.","Title: hot pot [SEP] Summary: you really didn't want to be at the party despite that it was your best friend who was throwing it, who would have thought that it would end up the best night of your life though when a toilet paper mummy comes to save your night and take you out to eat instead.","Hot Pot You really didn't want to be at the party despite that it was your best friend who was throwing it, who would have thought that it would end up the best night of your life though when a toilet paper mummy comes to save your night and take you out to eat instead.","hot pot you really didn't want to be at the party despite that it was your best friend who was throwing it, who would have thought that it would end up the best night of your life though when a toilet paper mummy comes to save your night and take you out to eat instead.",54,2,59
https://golemlab.eu/graph/35677171,16,Your Guardian Angel,"Ever secretly been in love with your best friend just to have to watch them go through some of the worst moments of their life and not be able to help? Seokjin has. He just wants to help you, to love you, to be your guardian angel...will you let him? CW: This is a heavy fic with depictions of domestic violence and mental manipulation/degradation. Reader(written without using y/n) starts off in an established relationship with some serious** issues. This is in no way a glorification of these acts, it's intended as the opposite. Everything is written based on personal experience with minor changes to fit into a fanfic narrative and for personal privacy. There can be a happy ending, I promise, but to get there we got a little bit of a bumpy road to get down. **Please check for any further CWs at the start of each chapter. -The tags can only cover so much- This is part of a new series I'm working on called Heartbeat Melodies, stories inspired by songs. This particular story is inspired by Your Guardian Angel by The Red Jumpsuit Apparatus",2021-12-13,14887,Explicit,F/M,Completed,Angst | Angst and Fluff and Smut | Blood and Injury | Death Threats | Domestic Violence | Drinking | Emotional Manipulation | Emotional/Psychological Abuse | Explicit Language | Fist Fights | Fluff and Smut | Friends to Lovers | Healing | Physical Abuse | Soft Kim Seokjin | Jin | Sweet Kim Seokjin | Jin | Threats of Violence | Vaginal Sex | Verbal Abuse | self-deprecation | soft smut,Kim Seokjin | Jin/Reader Series: Heartbeat Melodies [1],False,seokjin,{'seokjin'},"Title: Your Guardian Angel [SEP] Summary: Ever secretly been in love with your best friend just to have to watch them go through some of the worst moments of their life and not be able to help? Seokjin has. He just wants to help you, to love you, to be your guardian angel...will you let him? CW: This is a heavy fic with depictions of domestic violence and mental manipulation/degradation. Reader(written without using y/n) starts off in an established relationship with some serious** issues. This is in no way a glorification of these acts, it's intended as the opposite. Everything is written based on personal experience with minor changes to fit into a fanfic narrative and for personal privacy. There can be a happy ending, I promise, but to get there we got a little bit of a bumpy road to get down. **Please check for any further CWs at the start of each chapter. -The tags can only cover so much- This is part of a new series I'm working on called Heartbeat Melodies, stories inspired by songs. This particular story is inspired by Your Guardian Angel by The Red Jumpsuit Apparatus",{'Seokjin'},your guardian angel,"ever secretly been in love with your best friend just to have to watch them go through some of the worst moments of their life and not be able to help? [MEMBER] has. he just wants to help you, to love you, to be your guardian angel...will you let him? cw: this is a heavy fic with depictions of domestic violence and mental manipulation/degradation. reader(written without using You) starts off in an established relationship with some serious** issues. this is in no way a glorification of these acts, it's intended as the opposite. everything is written based on personal experience with minor changes to fit into a fanfic narrative and for personal privacy. there can be a happy ending, i promise, but to get there we got a little bit of a bumpy road to get down. **please check for any further cws at the start of each chapter. -the tags can only cover so much- this is part of a new series i'm working on called heartbeat melodies, stories inspired by songs. this particular story is inspired by your guardian angel by the red jumpsuit apparatus","Title: your guardian angel [SEP] Summary: ever secretly been in love with your best friend just to have to watch them go through some of the worst moments of their life and not be able to help? [MEMBER] has. he just wants to help you, to love you, to be your guardian angel...will you let him? cw: this is a heavy fic with depictions of domestic violence and mental manipulation/degradation. reader(written without using You) starts off in an established relationship with some serious** issues. this is in no way a glorification of these acts, it's intended as the opposite. everything is written based on personal experience with minor changes to fit into a fanfic narrative and for personal privacy. there can be a happy ending, i promise, but to get there we got a little bit of a bumpy road to get down. **please check for any further cws at the start of each chapter. -the tags can only cover so much- this is part of a new series i'm working on called heartbeat melodies, stories inspired by songs. this particular story is inspired by your guardian angel by the red jumpsuit apparatus","Your Guardian Angel Ever secretly been in love with your best friend just to have to watch them go through some of the worst moments of their life and not be able to help? Seokjin has. He just wants to help you, to love you, to be your guardian angel...will you let him? CW: This is a heavy fic with depictions of domestic violence and mental manipulation/degradation. Reader(written without using y/n) starts off in an established relationship with some serious** issues. This is in no way a glorification of these acts, it's intended as the opposite. Everything is written based on personal experience with minor changes to fit into a fanfic narrative and for personal privacy. There can be a happy ending, I promise, but to get there we got a little bit of a bumpy road to get down. **Please check for any further CWs at the start of each chapter. -The tags can only cover so much- This is part of a new series I'm working on called Heartbeat Melodies, stories inspired by songs. This particular story is inspired by Your Guardian Angel by The Red Jumpsuit Apparatus","your guardian angel ever secretly been in love with your best friend just to have to watch them go through some of the worst moments of their life and not be able to help? [MEMBER] has. he just wants to help you, to love you, to be your guardian angel...will you let him? cw: this is a heavy fic with depictions of domestic violence and mental manipulation/degradation. reader(written without using You) starts off in an established relationship with some serious** issues. this is in no way a glorification of these acts, it's intended as the opposite. everything is written based on personal experience with minor changes to fit into a fanfic narrative and for personal privacy. there can be a happy ending, i promise, but to get there we got a little bit of a bumpy road to get down. **please check for any further cws at the start of each chapter. -the tags can only cover so much- this is part of a new series i'm working on called heartbeat melodies, stories inspired by songs. this particular story is inspired by your guardian angel by the red jumpsuit apparatus",192,3,198
https://golemlab.eu/graph/35973772,16,Christmas Under Wraps,"You always wanted to work in a small town, and when you finally got matched to a small hospital in Alaska for your one year sabbatical you never would’ve thought you’d be in a place where everyone believed Santa was real. Mass hysteria or magic? Only time will tell.",2021-12-26,12072,Explicit,F/M,Completed,Angst | Cheating | Crack | Dom Kim Seokjin | Jin | Edging | Explicit Sex | Fantasy | Fluff | Multiple Orgasms | Nurse Kim Seokjin | Jin | Oral Sex | Reader-Insert | Smut | Strangers to Lovers | Whiny Kim Seokjin | Jin | me having no knowledge of Alaska | mentions of the horrendous Mario movie | shitty parents | too many references to Santa | very bad puns | whiny!Jin,Kim Seokjin | Jin/Reader,False,seokjin,{'seokjin'},"Title: Christmas Under Wraps [SEP] Summary: You always wanted to work in a small town, and when you finally got matched to a small hospital in Alaska for your one year sabbatical you never would’ve thought you’d be in a place where everyone believed Santa was real. Mass hysteria or magic? Only time will tell.",set(),christmas under wraps,"you always wanted to work in a small town, and when you finally got matched to a small hospital in alaska for your one year sabbatical you never would’ve thought you’d be in a place where everyone believed santa was real. mass hysteria or magic? only time will tell.","Title: christmas under wraps [SEP] Summary: you always wanted to work in a small town, and when you finally got matched to a small hospital in alaska for your one year sabbatical you never would’ve thought you’d be in a place where everyone believed santa was real. mass hysteria or magic? only time will tell.","Christmas Under Wraps You always wanted to work in a small town, and when you finally got matched to a small hospital in Alaska for your one year sabbatical you never would’ve thought you’d be in a place where everyone believed Santa was real. Mass hysteria or magic? Only time will tell.","christmas under wraps you always wanted to work in a small town, and when you finally got matched to a small hospital in alaska for your one year sabbatical you never would’ve thought you’d be in a place where everyone believed santa was real. mass hysteria or magic? only time will tell.",51,3,57
https://golemlab.eu/graph/8880325,16,Eomma and appa,^this means they are talking in english,2016-12-17,271,General Audiences,F/M,Completed,Fluff | Marriage Proposal,Kim Seokjin | Jin/Reader Series: Bangtan one shots [1],False,seokjin,{'seokjin'},Title: Eomma and appa [SEP] Summary: ^this means they are talking in english,set(),eomma and appa,^this means they are talking in english,Title: eomma and appa [SEP] Summary: ^this means they are talking in english,Eomma and appa ^this means they are talking in english,eomma and appa ^this means they are talking in english,7,3,13
https://golemlab.eu/graph/40824684,16,Crossing Lines,A fun night with your best friend to escape the post-breakup blues turns into so much more than you expected.,2022-08-05,1847,Explicit,F/M,Completed,Angst | Dirty Talk | Drinking | Drinking Games | Fluff | Friends to Lovers | Masturbation | Mild Smut | Phone Sex | Seokjin and Bug are adorable idiots as always | Slow Burn | Swearing | mario kart is involved,Kim Seokjin | Jin/Reader Series: All For You [7],False,seokjin,{'seokjin'},Title: Crossing Lines [SEP] Summary: A fun night with your best friend to escape the post-breakup blues turns into so much more than you expected.,set(),crossing lines,a fun night with your best friend to escape the post-breakup blues turns into so much more than you expected.,Title: crossing lines [SEP] Summary: a fun night with your best friend to escape the post-breakup blues turns into so much more than you expected.,Crossing Lines A fun night with your best friend to escape the post-breakup blues turns into so much more than you expected.,crossing lines a fun night with your best friend to escape the post-breakup blues turns into so much more than you expected.,21,2,26
https://golemlab.eu/graph/33055891,16,What's Wrong with Secretary Y/n?,"Quitting your job was suppose to be easy. You worked for Jin for 7 years. You needed a life. You needed friends. But after telling him you'd be quitting, you didn't think it would be so hard to leave him.",2021-08-05,9596,Teen And Up Audiences,F/M,Completed,Eventual Romance | Fluff | Good Friend Jung Hoseok | J-Hope,"Kim Seokjin | Jin/Reader, Kim Seokjin | Jin/You",False,seokjin,{'seokjin'},"Title: What's Wrong with Secretary Y/n? [SEP] Summary: Quitting your job was suppose to be easy. You worked for Jin for 7 years. You needed a life. You needed friends. But after telling him you'd be quitting, you didn't think it would be so hard to leave him.",{'Jin'},what's wrong with secretary You?,"quitting your job was suppose to be easy. you worked for [MEMBER] for 7 years. you needed a life. you needed friends. but after telling him you'd be quitting, you didn't think it would be so hard to leave him.","Title: what's wrong with secretary You? [SEP] Summary: quitting your job was suppose to be easy. you worked for [MEMBER] for 7 years. you needed a life. you needed friends. but after telling him you'd be quitting, you didn't think it would be so hard to leave him.","What's Wrong with Secretary Y/n? Quitting your job was suppose to be easy. You worked for Jin for 7 years. You needed a life. You needed friends. But after telling him you'd be quitting, you didn't think it would be so hard to leave him.","what's wrong with secretary You? quitting your job was suppose to be easy. you worked for [MEMBER] for 7 years. you needed a life. you needed friends. but after telling him you'd be quitting, you didn't think it would be so hard to leave him.",42,6,51
https://golemlab.eu/graph/19073188,15,make up,Seokjin is late.,2019-06-03,493,General Audiences,F/M,Completed,Angst | Angst with a Happy Ending | Fluff | Fluff and Angst | How Do I Tag | Idol Kim Seokjin | Jin | Making Up | One Shot | Short,Kim Seokjin | Jin/Reader,False,seokjin,{'seokjin'},Title: make up [SEP] Summary: Seokjin is late.,{'Seokjin'},make up,[MEMBER] is late.,Title: make up [SEP] Summary: [MEMBER] is late.,make up Seokjin is late.,make up [MEMBER] is late.,3,2,8
https://golemlab.eu/graph/35290450,15,10... 9... 8...,You sent him a nude of yourself lying on his bed in the middle of his workday and it's all he can think about.,2021-11-23,398,Mature,F/M,Completed,Canon Compliant | Established Relationship,Kim Seokjin | Jin/Reader,False,seokjin,{'seokjin'},Title: 10... 9... 8... [SEP] Summary: You sent him a nude of yourself lying on his bed in the middle of his workday and it's all he can think about.,set(),10... 9... 8...,you sent him a nude of yourself lying on his bed in the middle of his workday and it's all he can think about.,Title: 10... 9... 8... [SEP] Summary: you sent him a nude of yourself lying on his bed in the middle of his workday and it's all he can think about.,10... 9... 8... You sent him a nude of yourself lying on his bed in the middle of his workday and it's all he can think about.,10... 9... 8... you sent him a nude of yourself lying on his bed in the middle of his workday and it's all he can think about.,25,3,31
https://golemlab.eu/graph/12343293,15,A R T (I S T),"Bangtan are artists: it only makes sense that they would fall in love with an artist, right",2017-10-12,1391,Explicit,F/M,In-Progress,( plz ) | Art | Sculpture | different artist | different reader | each chapter is a different universe | enjoy | reader - Freeform | sculptor!reader,Kim Seokjin | Jin/Reader,False,seokjin,{'seokjin'},"Title: A R T (I S T) [SEP] Summary: Bangtan are artists: it only makes sense that they would fall in love with an artist, right",{'Bangtan'},a r t (i s t),"bangtan are artists: it only makes sense that they would fall in love with an artist, right","Title: a r t (i s t) [SEP] Summary: bangtan are artists: it only makes sense that they would fall in love with an artist, right","A R T (I S T) Bangtan are artists: it only makes sense that they would fall in love with an artist, right","a r t (i s t) bangtan are artists: it only makes sense that they would fall in love with an artist, right",17,6,26
